,영화제목,관람등급,네티즌평점,참여인원수,현 예매율,장르,시간,개봉일,감독,출연,소개
106,체리 향기,12세 관람가,8.75,145,0.01,"드라마, 실험",99분,1998.01.01,압바스 키아로스타미,"호먀윤 엘샤드, 아브돌라만 바그헤리","97년 깐느 영화제에서 이란 정부의 출국금지 조치로 출품되지 못하다가, 폐막 3일전, 이 영화의 상영 공고가 붙으면서 공식 경쟁작의 명단에도 없었고, 영화제 공식 책자에도 실리지 않은 영화가 출품되기도 했는데 결국 왕가위의 <해피 투게더>, 아톰 에고이앙의 <달콤한 내세>, 이안의 <얼음폭풍>을 제치고 황금 종려상을 수상하는 이변을 낳으면서 큰 화제를 모은 작품이다. 1994년 <올리브 나무 사이로> 이후 3년 여의 공백기 만에 발표한 작품이며 키아로스타미가 직접 제작까지 맡은 첫 영화이다. 한 남자가 자동차를 몰고 황량한 벌판을 달려간다. 그는 지나치는 사람들을 눈여겨 보며 자신의 차에 동승할 사람을 찾는다. 그가 찾고 있는 사람은 수면제를 먹고 누운 자신의 위로 흙을 덮어 줄 사람. 돈은 얼마든지 주겠다는 그의 간절한 부탁에도 사람들은 고개를 젓는다. 애띤 얼굴의 군인도, 온화한 미소의 신학도도 죽음이란 단어 앞에선 단호하게 외면할 뿐. 드디어 한 노인이 그의 제안을 수락한다. 박물관에서 새의 박제를 만드는 노인은 주인공 바디(Mr. Badii: Homayon Ershadi 분)에게 자신의 살아온 이야기를 해주며 작지만 소중한, 삶의 기쁨들을 하나씩 펼쳐 놓는다. 노인의 이야기를 들으며 불현 듯 삶에 대해 강한 애착을 느끼는 바디. 운동장을 뛰어노는 아이들의 재잘거림, 도시의 하늘 너머 펼쳐지는 저녁노을의 눈부신 빛깔. 밤이 오고 바디는 수면제를 먹고 자신이 파놓은 구덩이 안에 눕는다. 조금은 긴장된 그의 얼굴 위로 푸른 달빛이 서리고. 때맞춰 내리는 비. 사방은 온통 어둠뿐. 가끔씩 치는 번개의 빛에 그의 얼굴이 잠깐 보였다간 사라지는데. 아침이 오면 그는 그토록 바라던 죽음을 얻게될까? 아니면."
107,초속5센티미터,전체 관람가,8.36,"4,168",0.01,"애니메이션, 드라마",62분,2017.11.02,신카이 마코토,"미즈하시 켄지, 하나무라 사토미, 오노우에 아야카","초등학교 졸업과 동시에 떨어져 있게 된 ‘타카키’와 ‘아카리’. 둘만의 특별한 추억만 남은 채 시간이 흐른다. 폭설이 내리던 어느 날 밤, ‘타카키’는 ‘아카리’를 찾아 나서는데…"
108,초행,12세 관람가,7.71,269,0.01,드라마,100분,2017.12.07,김대환,"김새벽, 조현철","7년차 커플 수현(조현철)과 지영(김새벽)  그들에게 결혼을 생각할 시기가 찾아온다. 미술 강사와 방송국 계약직이라는 현실,  지영 어머니의 결혼 강요와 수현의 복잡한 가정사  '우리... 어디로 가야 하는 걸까?'"
109,크레센도,12세 관람가,9.02,40,0.01,드라마,112분,2021.06.24,드로 자하비,"페테르 시모니슈에크, 다니엘 돈스코이, 사브리나 아마리, 메흐디 메스카르, 비비아나 베글라우, 괴츠 오토","세계적인 마에스트로 ‘에두아르트’는 평화 콘서트를 위해  오디션을 거쳐 이스라엘과 팔레스타인의 재능 있는 연주자들을 뽑는다.  수십 년간 이어온 분쟁과 갈등을 넘어 오직 음악을 바라보고 모였지만,  깊이 담겨 있던 분노와 증오는 이내 서로를 공격한다.   하나의 오케스트라를 위해 지휘자 ‘에두아르트’는 진심을 담아 노력하고 영원히 평행선을 걸을 것 같던 이들은 조금씩 서로를 이해하기 시작한다.   그러나 공연을 하루 앞두고  팔레스타인 클라리넷 연주자 ‘오마르’와 이스라엘 프렌치 호른 연주가 ‘쉬라’가 사라지는데… 오케스트라 공연은 무사히 열릴 수 있을까?  평화를 향한 희망의 멜로디가 울려 퍼진다!"
110,타오르는 여인의 초상,15세 관람가,9.05,"1,806",0.01,드라마,121분,2020.01.16,셀린 시아마,"아델 에넬, 노에미 메를랑, 루아나 바야미, 발레리아 골리노","초상화를 그리는 화가 마리안느(노에미 멜랑)는  원치 않는 결혼을 앞둔 귀족 아가씨 엘로이즈(아델 에넬)의 결혼 초상화 의뢰를 받는다.  엘로이즈 모르게 그림을 완성해야 하는 마리안느는 비밀스럽게 그녀를 관찰하며 알 수 없는 묘한 감정의 기류에 휩싸이게 된다.    잊을 수 없는, 잊혀지지 않을 사랑의 기억을 마주하게 할 걸작을 만난다!"
111,패터슨,12세 관람가,8.31,"1,206",0.01,드라마,118분,2017.12.21,짐 자무쉬,"아담 드라이버, 골쉬프테 파라하니",미국 뉴저지 주의 소도시 ‘패터슨’에 사는 버스 운전사의 이름은 ‘패터슨’이다. 매일 비슷한 일상을 보내는 패터슨은 일을 마치면 아내와 저녁을 먹고 애완견 산책 겸 동네 바에 들러 맥주 한 잔으로 하루를 마무리한다. 그리고 일상의 기록들을 틈틈이 비밀 노트에 시로 써내려 간다.
112,릴리 슈슈의 모든 것,15세 관람가,8.11,"1,354",,드라마,145분,2021.08.08,이와이 슌지,"이치하라 하야토, 오시나리 슈고",'릴리 슈슈'의 노래를 너무나 사랑하는 열네 살 소년 유이치. 그러나 그의 일상은 힘들다. 둘도 없는 단짝 친구 호시노가 어느날 반 아이들의 리더가 되어 자신을 이지메 시키고 첫사랑 쿠노 역시 이지메를 당하지만 그녀를 도와주기에는 자신의 슬픔을 감당하기에도 벅차다. 소년의 유일한 안식처는 오로지 영혼을 뒤흔드는 듯한 ‘릴리 슈슈’의 노래 뿐... 그러나 현실은 노래로 감출 만큼 만만하지 않다...
113,미스 사이공: 25주년 특별 공연,15세 관람가,9.22,281,,공연실황,175분,2016.11.24,브렛 설리반,"알리스태어 브래머, 에바 노블자다, 홍광호, 존 존 브라이언스","1975년 베트남 전쟁에 참가한 미군 크리스(앨리스테어 브라머)는 클럽 ‘드림랜드’에서 전쟁 고아 킴(에바 노블자다)을 만나 사랑에 빠지고 결혼식을 올린다. 하지만 1978년 호찌민 정부가 들어서고 미군이 급히 철수하게 되면서 크리스는 미국으로 돌아가게 되고 킴은 베트남에 홀로 남겨진 채 아들 탬을 낳게 된다. 한편, 킴의 약혼자였던 투이(홍광호)는 호찌민 정부 위원이 되어 반역자로 몰린 킴을 찾아와 결혼을 강요하지만, 킴이 자신의 청혼을 거절하자 위험한 선택을 하게 되는데"
114,숫호구,청소년 관람불가,6.75,222,,코미디,80분,2014.08.07,백승기,"백승기, 손이용, 박지나","서른 살이 되도록 제대로 된 연애 한 번, 사랑 한 번 못해본 욕구불만 청년 숫호구 ‘원준’은 열등감으로 가득 차 있다. 또래 친구들은 다 하는 번듯한 직장생활, 연애, 결혼도 원준은 쉽게 할 수가 없다.   그러던 어느 날 정체불명의 생명공학 박사가 진행한 비밀 생체실험으로 인해 자신이 직접 들어가 마음껏 조종할 수 있는 완벽한 몸매와 얼굴(?)의 슈퍼 섹시 아바타를 갖게 된다.  원준은 그 동안 누려보지 못했던 쾌락을 맘껏 누릴 수 있게 되고 기존의 자신의 삶과는 전혀 다른 삶을 살게 된다. 그러던 중 동네 헌 책방의 신입 아르바이트생 ‘지나’를 보고 사랑에 빠지게 되지만, 그녀는 원준의 본 모습이 아닌 아바타의 모습을 사랑하게 되는데…"
115,"시발, 놈: 인류의 시작",15세 관람가,6.56,218,,"코미디, 드라마",71분,2016.08.18,백승기,"손이용, 김보리","태초에 하늘에서 빛이 떨어지매 천지를 울리는 폭발이 있었고 원숭이의 형상을 닮은 사람이 나타나되 나무에서 사과가 떨어져 머리를 맞추니 유래각!(流來覺: 깨달음이 와서 흐르다)하여 생각을 하게 되었으며 생육하고 번성하여 땅에 충만하게 되고 후대는 이를 인류의 시작 시발(始發)놈이라고 불렀더라. -시발세기(始發世記) 1장 18절-  인류가 시작된 건 다 너 때문이다, 시발(始發)놈아!  인간의 욕심은 끝이 없고, 같은 실수를 반복한다? 왜 이렇게 인생이 고달픈지, 도대체 어디서부터 뭐가 어떻게 잘못된 건지! 답 없는 내 인생, 해답의 실마리를 풀어보려 시간을 거슬러 올라가니 시작은 무려 4만 년 전! 내 인생을 망치러 온 나의 구원자, 나의 시발(始發)놈!"
116,오늘도 평화로운,15세 관람가,6.77,145,,"액션, 코미디",90분,2019.04.04,백승기,손이용,영화감독이 꿈인 영준은 영화를 만들기 위해 오늘도 평화로운 그곳에서 노트북을 사려다 사기를 당한다. 직접 사기꾼들을 잡겠노라 결심한 영준은 무작정 중국으로 떠나는데…
117,위플래쉬,15세 관람가,8.80,"10,080",,드라마,106분,2020.10.28,데이미언 셔젤,"마일즈 텔러, J.K. 시몬스","뉴욕의 명문 셰이퍼 음악학교에서 최고의 스튜디오 밴드에 들어가게 된 신입생 '앤드류'  최고의 지휘자이지만 동시에 최악의 폭군인 '플레쳐'교수는 폭언과 학대로 '앤드류'를 한계까지 몰아붙이고 또 몰아붙인다.  드럼 주위로 뚝뚝 떨어지는 피, 빠르게 달리는 선율 뒤로 아득해지는 의식, 그 순간, 드럼에 대한 앤드류의 집착과 광기가 폭발한다.  최고의 연주를 위한 완벽한 스윙이 시작된다!"
118,인천스텔라,12세 관람가,6.60,119,,"SF, 가족, 멜로/로맨스",108분,2021.03.25,백승기,"손이용, 강소연, 정광우, 권수진","27년 전, 우주로부터 도착한 정체불명의 구조신호. 그 목소리는 자신이 있는 곳인 갬성(STARGAM)에 닿을 수 있는 유일한 우주선 ‘인천스텔라’의 설계도를 남겼다.  27년 후, ASA(아시아항공우주국)는 이를 따라 ‘인천스텔라’ 프로젝트에 착수하게 되고, 최고의 탐사대원 ‘기동’과 엔지니어 ‘승연’이 성공적인 임무 완수를 위해 우주선에 몸을 싣는다. 한편, 지구에 남은 ‘규진’은 그들에게 닿을 수 있는 새로운 방법을 찾게 되는데…  바로 지금, 인류 역사상 가장 로맨틱한 우주 탐사가 시작된다!"
119,하나와 앨리스,12세 관람가,8.11,"1,611",,멜로/로맨스,135분,2014.07.10,이와이 슌지,"아오이 유우, 스즈키 안, 카쿠 토모히로","하나는 어릴 때부터 단짝 친구인 앨리스가 점찍은 남자애를 보여준다며 끌고 간 곳에서 마음을 콩닥뛰게 만드는 꽃미남 소년 미야모토를 발견한다. 몰래 뒷조사를 통해 확인한 바로 미야모토는 한 학년 선배이자 만담동호회 회원. 하나는 만담동호회에 가입해서 미야모토의 관심을 얻기 위해 호시탐탐 기회를 엿본다. 그러던 어느 날, 하나는 마침내 넘지 말아야 할 선(?)을 넘게 된다. (이런!) 머리 다친 선배에게 기억 상실이라 뻥친 것도 모자라 '나한테 사랑 고백했잖아!'라고 외치는 귀여운 스토커 하나. 그리고 친구의 애정사기극(?)에 거침없이 동참한 앨리스. 그러나 그들의 우정은 미야모토로 인해 예기치 않은 삼각관계로 발전하는데..."
