,영화제목,관람등급,네티즌평점,참여인원수,현 예매율,장르,시간,개봉일,감독,출연,소개
74,콜드 워,15세 관람가,6.35,86,0.01,"액션, 범죄, 미스터리",102분,2013.09.05,써니 럭,"곽부성, 양가휘, 유덕화, 펑위옌, 리즈팅, 바이런 만","아시아 최고의 치안도시 홍콩에서 경찰 5명이 납치되는 전무후무한 충격적 사건이 벌어진다. 경무처장이 출장으로 자리를 비운 사이, 차기 처장의 유력한 후보로 지목되는 두 명의 부처장 (곽부성, 양가휘)은 경찰의 명예가 걸린 비공개 테러 진압작전 ‘콜드워’의 주도권을 놓고 첨예한 신경전을 벌인다. 사건의 실마리는커녕 용의자 조차 예측할 수 없는 최악의 상황이 되자 실리주의 야망가인 부처장 이문빈(양가휘)은 강직하고 냉철한 부처장 류걸휘(곽부성)에게 작전을 넘긴다.  작전 진행 중 테러범이 파놓은 함정에 빠져 속수무책으로 당하기만 하는 류걸휘(곽부성)는 내부 소행을 의심하기에 이른다. 실체를 알 수 없는 범인의 두뇌 게임에 경찰들이 희생되어 가는 가운데 부패방지국(ICAC)이 수사에 개입되며 홍콩경찰의 내분은 최고조에 다다르는데!  <무간도> 이후 10년, 홍콩 범죄액션 느와르가 부할한다!"
75,트랜짓,12세 관람가,8.11,63,0.01,"드라마, SF",101분,2020.07.02,크리스티안 펫졸드,"프란츠 로고스키, 폴라 비어","모두가 떠나는 곳에서 그녀를 만났다 독일군이 파리로 진군하자 ‘게오르그’는 마르세유로 탈출한다. 그는 자살한 ‘바이델’ 작가의 가방을 갖고 있는데 가방에는 작가의 원고와 아내에게서 온 편지, 멕시코 대사관에서 온 비자 허가서가 있다. ‘게오르그’는 ‘바이델’ 작가로 신분을 위조해 멕시코로 떠나려 하지만 신비한 여인 ‘마리’를 만나며 모든 것이 변하게 된다."
76,피닉스,12세 관람가,8.48,73,0.01,드라마,98분,2021.07.22,크리스티안 펫졸드,"니나 호스, 로날드 제르필드, 니나 쿤젠도르프",1945년 6월 아우슈비츠 생존자 넬리가 고향으로 돌아온다. 그녀의 얼굴은 심하게 훼손된 상태.  성형 수술을 받고 회복된 넬리는 사랑하는 남편 조니를 찾아 나선다. 마침내 재회하지만 아내가 죽었다고 믿는 조니는 얼굴이 변한 넬리를 알아보지 못한다.
77,학교 가는 길,12세 관람가,9.56,160,0.01,다큐멘터리,99분,2021.05.05,김정인,"이은자, 정난모, 조부용, 장민희, 김남연","전국 특수학교 재학생의 절반은 매일 왕복 1~4시간 거리를 통학하며 전쟁 같은 아침을 맞이한다  장애 학생 수에 비해 턱없이 부족한 특수학교 아이를 위해 거리로 나선 엄마들은 무릎까지 꿇는 강단으로 맞서는데…  세상을 바꾼 사진 한 장, 엄마들의 용기 있는 외침이 시작된다!"
78,나는 나를 해고하지 않는다,12세 관람가,7.99,276,0.01,드라마,111분,2021.01.28,이태겸,"유다인, 오정세","7년간 근무했던 회사에서 하청 업체로 파견 명령을 받은 정은, 자신의 자리를 찾아보려 하지만 사람들은 그녀를 불편해하고, 현장 일은 낯설다. 그러나 반드시 1년을 채워 원청으로 돌아가고 싶은 정은은 ‘막내’의 도움으로 점점 적응해가는데… 1년의 파견, 살아남기 위해 치열하게 도약하다!  제38회 파지르국제영화제 Eastern Vista 여우주연상"
79,남색대문,12세 관람가,8.26,66,0.01,"드라마, 멜로/로맨스",83분,2021.08.18,이치엔,"계륜미, 진백림, 양우림","단짝 친구 ‘위에전’에게 사랑을 느끼는 ‘커로우’ 같은 학교 남학생 ‘시하오’를 짝사랑하는 ‘위에전’ 그리고 ‘커로우’의 비밀을 알지만 사랑을 멈출 수 없는 ‘시하오’  “이 여름이 지나고 나면, 내 마음이 선명해질까?”  누군가를 좋아하는 감정에 어쩔 줄 몰랐던 열일곱  가슴 아린 짝사랑과 설레는 첫사랑 사이에서 한 여름의 성장통을 지나는 세 청춘의 이야기"
80,너의 췌장을 먹고 싶어,12세 관람가,8.10,"4,921",0.01,드라마,115분,2017.10.25,츠키카와 쇼,"하마베 미나미, 키타무라 타쿠미","스스로를 외톨이로 만드는 ‘나’ 학교 최고의 인기인 ‘그녀’  어느 날, 우연히 주운 [공병문고]를 통해 나는 그녀와 비밀을 공유하게 되었다.  “너 말이야, 정말 죽어?” “...응, 죽어”  그날 이후, 너의 무언가가 조금씩 내게로 옮겨오고 있다."
81,담쟁이,15세 관람가,7.88,108,0.01,"가족, 드라마",99분,2020.10.28,한제이,"우미화, 이연, 김보민","누구보다 행복한 은수, 예원 커플은 갑작스러운 은수의 교통사고로 일상이 흔들리게 된다. 오래도록 재활을 해야 하는 은수는 예원에게 짐이 될 수 없어 이별을 말하지만 예원은 사랑하는 은수의 곁을 지킨다. 하지만 은수와 예원은 하나 둘 커져가는 현실의 벽을 마주하게 되는데…  절망적인 현실 앞에 사랑을 떠나보내려는 은수 절망적인 현실 앞에서 사랑을 지키려는 예원  “우리 변하는 거 없지…” 가장 아름다운 형태의 사랑이 찾아옵니다"
82,독일 영년,,9.00,21,0.01,드라마,74분,2004.06.29,로베르토 로셀리니,프랜즈-오토 크루거,제2차 대전 직후 폐허가 된 베를린을 무대로 세상에 내던져진 한 소년의 정신적 방황과 자살을 다룬 작품. 이 영화가 완성되기 전에 어린 나이로 사망한 로셀리니의 아들 로마노에게 헌정되었다. 주인공인 에드문트는 어린 나이에도 불구하고 생계비를 벌기 위해 거리로 나가 일거리를 찾는다. 그는 우연히 자신이 예전에 다니던 학교의 교사를 만나게 되는데 사실 그는 나치 잔당의 일원으로 결국 어린 에드문트의 삶을 치명적인 국면으로 몰고 가게 된다.
83,드롭박스,전체 관람가,9.41,102,0.01,다큐멘터리,79분,2016.05.19,브라이언 아이비,이종락,"작은 상자 안에 담긴 형언할 수 없는 생명의 무게! 가장 절실한 사랑이 있는 곳 <드롭박스>  서울 난곡에 위치한 주사랑공동체교회에는 세상에서 가장 절실한 사랑이 있는 장소가 있다. 2009년 만들어진 이후 약 800여 명의 목숨을 살린 '생명의 상자'  진정한 용기, 존귀한 생명을 향한 소중한 메시지 그리고 세상의 편견과 차별, 오해를 딛고 진정한 가족이 된 사람들… 우리가 알지 못했던 '생명의 상자' 드롭박스에 관한 진짜 이야기가 시작된다!"
84,디스 아메리카노,15세 관람가,8.44,9,0.01,,,,권유주,"변세희, 한재하","영화감독 지망생인 수진은 자신의 첫 장편영화를 성공적으로 완성하기 위해 노력한다. 주변의 도움과 직접 모은 돈으로 제작하는 영화기에 제작비는 터무니없이 적다. 수진은 피우던 담배마저 저렴한 ‘디스 오리지널’로 바꾸고, 배우였던 전 남자친구에게 주연배우를 부탁해가며 열심히 영화를 준비하는데... 수진에게 청천벽력 같은 일이 일어난다! 과연 수진은 성공적으로 영화를 완성시킬 수 있을까?"
85,라스트 레터,전체 관람가,7.87,233,0.01,"멜로/로맨스, 드라마",120분,2021.02.24,이와이 슌지,"마츠 다카코, 히로세 스즈, 안노 히데아키, 카미키 류노스케","닿을 수 없는 편지로 그 시절, 전하지 못한 첫사랑의 기억과 마주한 이들의 결코- 잊지 못할 한 통의 러브레터"
86,레베카,15세 관람가,8.95,101,0.01,"드라마, 멜로/로맨스, 스릴러, 미스터리",130분,1954.03.02,알프레드 히치콕,"로렌스 올리비에, 주디스 앤더슨, 조안 폰테인","평범하고 수줍음 잘 타는 그녀는 몬테 카를로에서 몇년 전 아내 레베카와 사별한 부유한 신사 맥심을 만나 사랑에 빠진다.  그녀는 아직도 전처를 잃은 슬픔에 다소 불안정한 심리 상태의 맥심과 결혼 후 그의 대저택 '맨덜리'에 입성한다.  아름답지만 음산하고 기묘한 분위기를 풍기는 대저택 ‘맨덜리’는 죽은 레베카가 마치 살아 숨쉬고 있는 것처럼 레베카에게 깊게 물들어 있다.  집사 댄버스 부인 마저 시종일관 무표정함을 유지하며 경계심을 드러내 그녀를 노이로제 상태로 몰아간다.  하지만 남편 맥심은 자신의 심적 고통 때문에 미처 그녀에게 신경을 쓰지 못하고  그들 부부의 결혼 생활은 위기를 맞이하게 된다.  어느 비 바람 몰아치던 저녁, ‘맨덜리’ 저택의 비밀이 드러날 사건이 일어나는데…"
87,모로코 가는 길,,0.00,0,0.01,"모험, 가족, 코미디",83분,1948.09.24,데이빗 버틀러,"빙 크로스비, 밥 호프","제프(빙 크로스비 분)와 터키(밥 호프 분)가 밀항을 한 상선이 항해를 하던 중 사고로 침몰하면서 두 사람의 모험이 시작된다. 극적으로 생존한 두 사람은 아프리카 해안에 도착하고, 어렵게 사막을 건너 모로코로 가게 된다. 빈털터리였지만 굶주림에 지친 두 사람은 무작정 식당에 들어가 배불리 음식을 먹는데, 그때 나타난 노예상인이 제프에게 돈을 지불하고 터키를 노예로 산다. 터키가 팔려간 후, 양심의 가책을 받고 괴로워하던 제프는 결국 터키를 찾아 나선다. 그리고 웅장한 궁전에 잠입한 제프는 노예로 팔려간 줄 알았던 터키가 모로코 공주(도로시 라무르 분)와 멋진 시간을 보내고 있는 모습을 보고 깜짝 놀란다.  사실 공주는 세력가인 카심(안소니 퀸 분)과 결혼하기로 되어 있었지만, 첫 남편이 비명횡사하게 된다는 점성술사의 예언을 들은 공주가 터키를 희생양으로 선택한 것이었다. 한편, 공주는 터키를 찾아온 제프에게 반하게 되고, 마침 점성술사로부터 예언이 틀렸다는 말을 전해 듣자마자 제프와 결혼식을 올리게 된다. 하지만 소식을 전해들은 카심이 부하들을 이끌고 쳐들어와 공주와 하녀를 납치해 가고, 제프와 터키는 사막에 버려진다. 하지만 두 사람은 사막을 헤매다 카심의 본거지를 찾아내고, 우여곡절 끝에 공주와 하녀를 구출해낸다. 그리고 두 쌍의 남녀는 함께 미국으로 떠난다."
88,반도,15세 관람가,5.64,"31,327",0.01,"액션, 드라마",116분,2020.07.15,연상호,"강동원, 이정현","[전대미문의 재난 그 후 4년 폐허의 땅으로 다시 들어간다!]  4년 전, 나라 전체를 휩쓸어버린 전대미문의 재난에서 가까스로 탈출했던 ‘정석’(강동원). 바깥세상으로부터 철저히 고립된 반도에 다시 들어가야 하는 피할 수 없는 제안을 받는다.    제한 시간 내에 지정된 트럭을 확보해 반도를 빠져 나와야 하는 미션을 수행하던 중 인간성을 상실한 631부대와 4년 전보다 더욱 거세진 대규모 좀비 무리가 정석 일행을 습격한다.    절체절명의 순간, 폐허가 된 땅에서 살아남은 ‘민정’(이정현) 가족의 도움으로 위기를 가까스로 모면하고 이들과 함께 반도를 탈출할 수 있는 마지막 기회를 잡기로 한다.    되돌아온 자, 살아남은 자 그리고 미쳐버린 자 필사의 사투가 시작된다!"
89,밥정,전체 관람가,9.61,352,0.01,"다큐멘터리, 드라마",82분,2020.10.07,박혜령,임지호,"잔디, 잡초, 이끼, 나뭇가지.. 자연을 재료 삼아 요리를 만드는 방랑식객 임지호 셰프.  친어머니와 양어머니에 대한 아픈 사연을 간직한 그는 길에서 인연을 맺은 사람들에게 기꺼이 음식을 대접한다. 지리산에서 만난 김순규 할머니를 길 위의 어머니로 10년간 모시지만, 끝끝내 찾아온 3번째 이별. 임지호 셰프는 낳아주신, 길러주신, 그리고 마음을 나눠주신 3명의 어머니를 위해 3일 동안 108접시의 음식을 장만한다. ‘밥’으로 ‘정’을 나누는 인생의 참맛, 더 늦기 전에 당신과 나누고 싶습니다…"
90,부러진 창,,7.00,2,0.01,"모험, 서부",96분,1965.03.12,에드워드 드미트릭,"스펜서 트레이시, 로버트 와그너",
91,북간도의 십자가,전체 관람가,7.91,78,0.01,다큐멘터리,84분,2019.10.17,반태경,"문성근, 문동환, 심용환",나라를 잃고 고향을 떠나왔지만 대신 복음을 받아들인 북간도의 기독교인들. 그들이 손에 쥔 십자가는 독립을 향한 담대함의 상징이자 짊어져야할 시대의 소명이었다. 역사학자 심용환이 마지막 북간도 후예 故 문동환 목사의 회고를 따라 북간도 곳곳에 숨겨진 항일 독립 운동의 흔적과 의미를 좇는다.
92,블랙 위도우,12세 관람가,8.46,"7,368",0.01,"액션, 모험, SF",134분,2021.07.07,케이트 쇼트랜드,"스칼릿 조핸슨, 플로렌스 퓨, 레이첼 와이즈, 데이빗 하버","어벤져스의 히어로 블랙 위도우, ‘나타샤 로마노프’ (스칼렛 요한슨)는 자신의 과거와 연결된 레드룸의 거대한 음모와 실체를 깨닫게 된다.  상대의 능력을 복제하는 빌런 ‘태스크마스터’와 새로운 위도우들의 위협에 맞서 목숨을 건 반격을 시작하는 ‘나타샤’는 스파이로 활약했던 자신의 과거 뿐 아니라, 어벤져스가 되기 전 함께했던 동료들을 마주해야만 하는데…  폭발하는 리얼 액션 카타르시스! MCU의 새로운 시대를 시작할 첫 액션 블록버스터를 만끽하라!"
93,생산적 활동,,6.12,24,0.01,,,,오점균,"장경진, 이응재, 박홍순","20대 초반의 창노와 성미가 데이트를 하던 중 섹스가 하고 싶어진다. 하지만 그들은 돈도 없고 시간도 충분치 않다. 할 만한 장소를 찾아 헤매는 가련한 우리의 주인공들. ........... 결국 둘은 하고야 만다. (A 20-something couple is having a date. They want to make love but they don’t have enough money or time. They look for a place where they can have sex.)   제8회 부산국제영화제 와이드앵글 부문 (2003), 제7회 부천국제판타스틱영화제 판타스틱단편걸작선 부문 (2003), 제2회 미장센 단편영화제 ‘장르의 상상력전’ 심사위원 특별상 (2003), 제4회 전주국제영화제 단편영화 비평가주간 (2003), 서울독립영화제 단편경쟁부문 (2003), 한국예술종합학교 영상원 졸업작품(전문사과정)"
94,샤먼 로드,12세 관람가,9.56,18,0.01,다큐멘터리,105분,2021.07.03,최상진,"박성미, 꼴레뜨 그랑종-로조뜨","중세시대였다면 ‘마녀’라고 화형을 당했을 프랑스 여자 샤먼 꼴레뜨와 한국 여자 샤먼 성미의 운명적 만남과 우정. 성미와 꼴레뜨는 어렸을 때부터 들린 신의 음성과 영상들(visions)로 인해 남들과 다른 삶을 살 수밖에 없었고, 이를 천형이라 생각했다. 2014년 프랑스에서 열린 세계샤머니즘축제에서 서로를 만난 뒤에야, 꼴레뜨와 성미는 그들의 특별한 능력이 세상 사람들의 아픈 상처를 어루만져주기 위한 신의 선물이라는 걸 깨닫고 서로를 의지하며 샤먼 로드를 걷는다."
95,숏버스 감성행,12세 관람가,8.30,10,0.01,멜로/로맨스,93분,2021.08.19,강인석,"이문규, 정유민, 박영빈, 한서연, 김진태","[우리 둘만의 음악, 책, 그리고 여행] 새로운 풍경 속에서 익숙한 흔적을 찾고 있는 '소영', 파리의 어느 아름다운 거리를 랜선 산책 중인 '미화', 반짝이는 윤슬을 보며 새로운 시작을 준비하는 '정아'. 바다로, 프랑스로, <숏버스 감성행>의 그녀들과 떠나는 감성 여행. 우리 같이 여행 갈래요?"
96,스피릿,전체 관람가,8.53,19,0.01,"애니메이션, 모험",88분,2021.09.15,일레인 보겐,"이사벨라 머세드, 줄리안 무어, 제이크 질렌할, 마르사이 마틴, 맥케나 그레이스","어릴 적 엄마를 잃고 ‘코라’ 고모와 할아버지 손에 자란 호기심 많은 소녀 ‘럭키’는 방학동안 ‘코라’ 고모와 함께 아빠가 홀로 살고 있는 미라데로에 머물게 된다.  오랜만에 만난 아빠와의 서먹한 관계에서 어려움을 느끼던 ‘럭키’는 우연히 에너지 넘치는 야생마 ‘스피릿’을 만나 특별한 교감을 나누게 되고, 새로 사귄 친구 ‘아비게일’, ‘프루’와 함께하며 두근거림과 자유로움을 경험한다.  어느 날, ‘스피릿’과 그의 야생마 가족이 악당들에 의해 위험에 처하게 되고 ‘럭키’는 이들을 구하기 위해 친구들과 두려움을 무릅쓴 모험에 나서는데…"
97,아담,12세 관람가,7.18,11,0.01,드라마,101분,2021.08.25,마리암 투자니,"루브나 아자발, 니스린 에라디, 두아이 벨카우다, 아지즈 하타브","혼전 임신 사실을 숨겨야만 해서 고향은 떠난 여인 ‘사미아’는 일자리와 숙박시설을 찾아 카사블랑카를 정처 없이 떠돌다가, 남편과 사별 후 홀로 8살 딸 ‘와르다’를 키우며 빵집을 운영하는 무뚝뚝한 여인 ‘아블라’를 만난다.  처음에 ‘아블라’는 ‘사미아’를 냉정히 돌려보내지만, 위험한 길가에서 밤을 지새우는 ‘사미아’가 신경 쓰여 결국 자기 집에 며칠 간 머물며 함께 빵 만들기를 허락한다. 시간이 지나면서 세 사람은 서로에 대한 마음을 점차 열며, 생애 잊지 못할 치유의 경험을 하는데…"
98,올리버 색스: 그의 생애,12세 관람가,7.00,5,0.01,다큐멘터리,114분,2021.08.26,릭 번스,"올리버 색스, 빌 헤이스, 케이트 에드거, 로렌스 웨슐러","2015년 1월, 시한부 판정을 받고 올리버 색스는 “나의 생애”란 에세이를 뉴욕 타임즈에 기고하고, 삶의 마지막 순간을 담은 다큐멘터리를 제작하게 된다. 의학계의 시인, “아내를 모자로 착각한 남자”를 비롯한 베스트셀러 작가, 인간의 뇌라는 경이로운 우주의 탐험가 등 수많은 수식어들 사이에서 ‘이 아름다운 행성에 태어나 지각 있는 존재로 살아간 것에 대한 기쁨과 감사함’으로 삶의 마지막 순간까지도 눈물이 아닌 따스함을 남기는 올리버 색스의 경이로운 삶의 여정이 펼쳐진다."
99,우리의 20세기,15세 관람가,8.25,579,0.01,드라마,119분,2017.09.27,마이크 밀스,"아네트 베닝, 엘르 패닝, 그레타 거윅, 루카스 제이드 주만, 빌리 크루덥",산타바바라에서 쉐어하우스를 운영하는 55살의 싱글맘 도로시아는 하루하루 달라지는 사춘기 아들 제이미가 걱정이다. 그녀는 함께 사는 24살의 포토그래퍼 애비와 17살인 제이미의 친구 줄리에게 고민을 털어놓는다. 그렇게 시작된 그녀들의 인생 교육은 모두에게 새로운 변화를 가져오는데…
100,워터 릴리스,15세 관람가,8.99,161,0.01,"드라마, 멜로/로맨스",83분,2020.08.13,셀린 시아마,"아델 에넬, 폴린 아콰르, 루이즈 블라쉬르","“너한테 난 뭐야?” 싱크로나이즈드 선수 ‘플로리안’을 본 순간 ‘마리’는 덜컥 사랑에 빠져버린다. 하지만 ‘플로리안’은 모든 남성들의 선망을 받고, 남자들과 자유로운 관계를 맺는 것 처럼 보인다. ‘플로리안’의 모든 것이 알고 싶고, 갖고 싶은 ‘마리’. 한편, ‘마리’의 절친 ‘안나’는 수영부 남학생 ‘프랑수아’와 첫키스를 하기 위해 노력한다."
101,웬디,12세 관람가,6.20,56,0.01,"드라마, 판타지",111분,2021.06.30,벤 제틀린,"데빈 프랑스, 야슈아 막, 게이지 나퀸, 개빈 나퀸","기찻길 옆, 작은 식당이 세상의 전부인 소녀 ‘웬디’는 내면에 차오르는 호기심과 모험심으로 매일 새로운 세상을 꿈꾼다.  그러던 어느 날, ‘피터’가 나타나고 ‘웬디’와 쌍둥이 형제 ‘더글라스’, ‘제임스’를 이끌고 여정을 떠나게 된다. 그리고 자신의 의지로 어른이 되지 않고 영원히 어린이로 살 수 있는 신비로운 섬에 도착하게 되는데…"
102,자마,15세 관람가,6.37,19,0.01,드라마,115분,2021.08.26,루크레시아 마르텔,다니엘 기메네즈 카쵸,"18세기 말 스페인 식민지 남미의 한 벽지. 치안판사 자마는 스페인 국왕의 전근 발령을 초조하게 기다리지만 몇 년째 감감무소식이다. “비쿠냐 포르토” 라는 도적떼에 대한 소문이 지역 사회를 공포에 몰아넣는 가운데, 기약 없는 기다림에 지친 자마에게 유일한 도피처는 육체적 욕망을 탐닉하는 것뿐이다."
103,증발,전체 관람가,9.44,54,0.01,다큐멘터리,115분,2020.11.12,김성민,"최준원, 최용진, 최준선, 강성우","20여 년을 하루같이 딸의 행방을 쫓고 있는 용진씨. 세상은 벌써 준원이를 잊은 것 같지만 아빠에겐 포기란 없다. 드디어 장기실종 전담수사팀이 생기고 새 제보자까지 등장! 수사는 큰 전환점을 맞고, 용진 씨와 가족들은 다시 한번 희망의 끈을 부여잡는데…"
104,지금은맞고그때는틀리다,청소년 관람불가,6.45,"2,762",0.01,드라마,121분,2015.09.24,홍상수,"정재영, 김민희","실수로 영화감독 함춘수는 수원에 하루 일찍 내려간다. 다음날 특강을 기다리며 들른 복원된 궁궐에서 윤희정이라는 화가를 만난다. 둘은 윤의 작업실에 가서 윤의 그림을 구경하고, 저녁에는 회에다 소주를 많이 마신다. 거기서 가까워지는 두 사람. 다른 카페로 이동한 두 사람은 술을 더 마신다. 거기서 누군가의 질문 때문에 함은 자신의 결혼한 사실을 할 수 없이 말하게 되고, 윤은 함에게 많이 실망하게 된다…  이런 비슷한 만남과 헤어짐의 이야기가 다시 한 번 이어진다. 여자가 더 목소리가 위축되어 있고, 몸도 굽어져 있다. 둘이 돌아다니는 데는 비슷한데, 여기선 남자가 옷도 벗고 그런다."
105,천국보다 낯선,15세 관람가,8.46,150,0.01,드라마,89분,2017.11.16,짐 자무쉬,"존 루리, 에스터 벌린트, 리차드 에드슨","'신세계(The New World)'. 뉴욕 빈민가의 낡은 아파트에 사는 윌리에게 어느 날 사촌 에바가 찾아온다. 갑자기 군식구를 떠맡게 된 윌리는 처음엔 그녀를 성가셔 하지만 10일이 지나 에바가 떠날 무렵이 되자 왠지 모를 아쉬움을 느낀다.  '1년 후(One Year Later)'. 1년 후 윌리는 친구 에디와 함께 에바를 만나러 클리블랜드로 무작정 떠난다. 괴짜 로티 아주머니와 함께 사는 에바는 핫도그 가게 점원으로 무료한 일상을 보내고 있다. 세 사람은 함께 플로리다로 떠나기로 한다.  '천국(Paradise)'. 이들의 여정은 개경주에서 윌리와 에디가 가진 돈을 거의 다 날리게 되면서 어긋나기 시작한다. 두 사람이 남은 돈을 털어 경마에서 마지막 승부를 걸고 있을 때 에바는 우연치 않게 큰 돈을 손에 넣는다. 윌리와 에디를 기다리던 에바는 결국 혼자 공항으로 떠나고, 세 사람은 뿔뿔이 흩어진다. 언제 도착했건 이방인이기는 마찬가지인 이민자들에게 미국이라는 나라는 할리우드 영화가 보여주는 화려하고 꿈같은 파라다이스와는 거리가 멀다. 신세계의 꿈을 안고 도착한 에바에게 이 거대한 나라는 뉴욕이건, 클리블랜드건, 플로리다건 간에 쓸쓸하고 황량할 뿐이다."
